{"$schema":"https://json-schema.org/draft/2020-12/schema","title":"Compute Relay resolved remote runner manifest v1","type":"object","additionalProperties":false,"required":["manifest_version","job_id","attempt_id","attempt_nonce","bundle","inputs","input_manifest_sha256","execution","outputs","resources","network","timeouts"],"properties":{"manifest_version":{"const":"compute-relay/runner/v1"},"job_id":{"$ref":"#/$defs/id"},"attempt_id":{"$ref":"#/$defs/id"},"attempt_nonce":{"type":"string","pattern":"^[A-Za-z0-9._:-]{16,256}$"},"bundle":{"type":"object","additionalProperties":false,"required":["path","bytes","sha256"],"properties":{"path":{"$ref":"#/$defs/path"},"bytes":{"type":"integer","minimum":0,"maximum":104857600},"sha256":{"$ref":"#/$defs/sha256"}}},"inputs":{"type":"array","minItems":0,"maxItems":64,"items":{"type":"object","additionalProperties":false,"required":["name","path","target","bytes","sha256"],"properties":{"name":{"type":"string","pattern":"^[a-zA-Z0-9][a-zA-Z0-9._-]{0,63}$"},"path":{"$ref":"#/$defs/path"},"target":{"$ref":"#/$defs/path"},"bytes":{"type":"integer","minimum":0,"maximum":2147483648},"sha256":{"$ref":"#/$defs/sha256"}}}},"input_manifest_sha256":{"$ref":"#/$defs/sha256"},"execution":{"type":"object","additionalProperties":false,"required":["kind","command"],"properties":{"kind":{"enum":["python","shell"]},"command":{"type":"array","minItems":1,"maxItems":64,"items":{"type":"string","minLength":1,"maxLength":4096}},"working_directory":{"anyOf":[{"$ref":"#/$defs/path"},{"const":"."}]},"environment":{"type":"object","maxProperties":64,"propertyNames":{"pattern":"^[A-Za-z_][A-Za-z0-9_]{0,127}$"},"additionalProperties":{"type":"string","minLength":0,"maxLength":4096}},"dependencies":{"type":"object","additionalProperties":false,"required":[],"properties":{"python_requirements":{"$ref":"#/$defs/path"},"shell_setup":{"type":"array","minItems":0,"maxItems":32,"items":{"type":"array","minItems":1,"maxItems":32,"items":{"type":"string","minLength":1,"maxLength":4096}}}}}},"allOf":[{"if":{"properties":{"kind":{"const":"python"}}},"then":{"properties":{"command":{"prefixItems":[{"enum":["python","python3"]}]},"dependencies":{"not":{"required":["shell_setup"]}}}},"else":{"properties":{"command":{"prefixItems":[{"enum":["bash","sh"]}]}}}}]},"outputs":{"type":"array","minItems":1,"maxItems":64,"items":{"type":"object","additionalProperties":false,"required":["path","required"],"properties":{"path":{"$ref":"#/$defs/path"},"required":{"type":"boolean"},"kind":{"enum":["file","directory"]},"max_bytes":{"type":"integer","minimum":1,"maximum":4294967296}}}},"resources":{"type":"object","additionalProperties":false,"required":["accelerator"],"properties":{"accelerator":{"enum":["cpu","gpu"]},"minimum_gpu_count":{"type":"integer","minimum":1,"maximum":8},"minimum_gpu_memory_bytes":{"type":"integer","minimum":1,"maximum":274877906944}},"allOf":[{"if":{"properties":{"accelerator":{"const":"gpu"}}},"then":{"required":["minimum_gpu_count"]},"else":{"not":{"anyOf":[{"required":["minimum_gpu_count"]},{"required":["minimum_gpu_memory_bytes"]}]}}}]},"network":{"type":"object","additionalProperties":false,"required":["remote_internet"],"properties":{"remote_internet":{"enum":["disabled","required"]}}},"timeouts":{"type":"object","additionalProperties":false,"required":["remote_wall_seconds","setup_seconds","finalization_grace_seconds"],"properties":{"remote_wall_seconds":{"type":"integer","minimum":1,"maximum":86400},"setup_seconds":{"type":"integer","minimum":1,"maximum":21600},"finalization_grace_seconds":{"type":"integer","minimum":1,"maximum":3600},"execution_deadline":{"type":"string","format":"date-time","pattern":"^[0-9]{4}-[0-9]{2}-[0-9]{2}T[0-9]{2}:[0-9]{2}:[0-9]{2}Z$","description":"Immutable UTC setup/payload deadline, in whole seconds. Requires absolute_execution_deadline support. The earlier absolute or relative work budget wins; finalization is separately bounded."}}},"limits":{"type":"object","additionalProperties":false,"required":[],"properties":{"bundle_bytes":{"type":"integer","minimum":1,"maximum":104857600},"expanded_bytes":{"type":"integer","minimum":1,"maximum":524288000},"input_bytes":{"type":"integer","minimum":1,"maximum":4294967296},"artifact_bytes":{"type":"integer","minimum":1,"maximum":4294967296},"artifact_files":{"type":"integer","minimum":1,"maximum":10000},"stdout_bytes":{"type":"integer","minimum":1,"maximum":20971520},"stderr_bytes":{"type":"integer","minimum":1,"maximum":20971520}}}},"$defs":{"id":{"type":"string","pattern":"^[A-Za-z0-9][A-Za-z0-9._:-]{0,127}$"},"sha256":{"type":"string","pattern":"^[a-f0-9]{64}$"},"path":{"type":"string","minLength":1,"maxLength":240,"pattern":"^[ -~]+$","allOf":[{"not":{"pattern":"(^|/)\\.{1,2}(/|$)"}},{"not":{"pattern":"^/|/$|//"}},{"not":{"pattern":"[\\\\:*?\"<>|]"}}]}}}
